{
  "$schema": "http://json-schema.org/draft-07/schema#",
  "title": "User Profile Schema",
  "description": "Unified user profile for initialization and stateful behavioral adaptation (Commit 7).",
  "type": "object",
  "properties": {
    "user_id": {
      "type": "string",
      "description": "Unique identifier for the user."
    },
    "career_phase": {
      "type": "string",
      "enum": ["stabilization", "growth", "transition"],
      "description": "Current career phase of the user."
    },
    "weight_profiles": {
      "type": "object",
      "description": "Current weightings for each decision dimension.",
      "properties": {
        "risk_tolerance": {
          "type": "number",
          "minimum": 0,
          "maximum": 1,
          "description": "User's tolerance for risk in career decisions."
        },
        "ambiguity_tolerance": {
          "type": "number",
          "minimum": 0,
          "maximum": 1,
          "description": "User's tolerance for ambiguous or undefined roles."
        },
        "compensation_weight": {
          "type": "number",
          "minimum": 0,
          "maximum": 1,
          "description": "Relative importance of compensation in evaluations."
        },
        "structure_preference": {
          "type": "number",
          "minimum": 0,
          "maximum": 1,
          "description": "Preference for defined scope, reporting lines, and structured environments."
        },
        "decision_fatigue_index": {
          "type": "number",
          "minimum": 0,
          "maximum": 1,
          "description": "Approximate measure of the user's susceptibility to cognitive fatigue."
        }
      },
      "required": [
        "risk_tolerance",
        "ambiguity_tolerance",
        "compensation_weight",
        "structure_preference",
        "decision_fatigue_index"
      ]
    },
    "interaction_history": {
      "type": "array",
      "description": "Chronological log of user interactions with the LLM and engine outputs.",
      "items": {
        "type": "object",
        "properties": {
          "timestamp": {
            "type": "string",
            "format": "date-time",
            "description": "ISO 8601 timestamp of the interaction."
          },
          "prompt": {
            "type": "string",
            "description": "Prompt submitted by the user to the engine/LLM."
          },
          "engine_output": {
            "type": "object",
            "description": "Structured output produced by the evaluation engine for this prompt."
          },
          "user_feedback": {
            "type": "string",
            "description": "Optional user reflection, comment, or reaction to the engine's output."
          }
        },
        "required": ["timestamp", "prompt", "engine_output"]
      }
    }
  },
  "required": [
    "user_id",
    "career_phase",
    "weight_profiles",
    "interaction_history"
  ],
  "additionalProperties": false
}
